5,Все отлично и сбалансировано.,Переваги: Тихий и мощный.,Недоліки: Нет,

4,Купил данный ПК ,работает отлично. В играх выдает хорошую картинку ,не шумит и в целом довольный.,Переваги: цена ,производительность,Недоліки: нету,

0,Нанесена ли заранее термопаста и можно ли попросить предустановить ОС?,Переваги: -,Недоліки: -,

0,Какая материнка скажите пж?,

0,Операционная система есть ?,Переваги: -,Недоліки: -,

5,Долго выбирал пк для видео монтажа и нескольких игр. Игры работают на максимальных настройках все четко и гладко. Технические характеристики будут еще долго удовлетворять. Классный корпус, светится. Нужные входы находтя на передней панели. Подключил Дисплей Синема 23, красота. Не зря заказал с WiFi модулем, очень радует. Вдохновленный покупкой, сделал #мояраспаковка для Розетка, чего ранее не делал, т.к. не было на чем )) Если позволяет бюджет, то рекомендую брать не пожалеете!,Переваги: Высокая производительность, быстрый рендер видео, ультра высокие настройки в играх,Недоліки: Нет,

0,А видеокарта ATX,

5,Всем советую ставить Windows 10. Тогда все драйвера сразу встанут. Даже диски не понадобятся!,Переваги: Топ,Недоліки: Нет,

5,Всем советую!!! Купил ПК недавно пока успел скачать только Watch Dogs 2 поставил все на максимум(ультра) где супер точное количество fps незнаю т.к. незнаю как его смотреть:\ Но по ощущениям fps так 60.,Переваги: Все,Недоліки: Видюха попалась dual, а не strix но тоже все тянет на ультро,

0,Какое точное название этой версии видеокарты 1060,Переваги: -,Недоліки: -,

5,Все отлично и сбалансировано.,Переваги: Тихий и мощный.,Недоліки: Нет,

4,Купил данный ПК ,работает отлично. В играх выдает хорошую картинку ,не шумит и в целом довольный.,Переваги: цена ,производительность,Недоліки: нету,

0,Нанесена ли заранее термопаста и можно ли попросить предустановить ОС?,Переваги: -,Недоліки: -,

0,Какая материнка скажите пж?,

0,Операционная система есть ?,Переваги: -,Недоліки: -,

5,Долго выбирал пк для видео монтажа и нескольких игр. Игры работают на максимальных настройках все четко и гладко. Технические характеристики будут еще долго удовлетворять. Классный корпус, светится. Нужные входы находтя на передней панели. Подключил Дисплей Синема 23, красота. Не зря заказал с WiFi модулем, очень радует. Вдохновленный покупкой, сделал #мояраспаковка для Розетка, чего ранее не делал, т.к. не было на чем )) Если позволяет бюджет, то рекомендую брать не пожалеете!,Переваги: Высокая производительность, быстрый рендер видео, ультра высокие настройки в играх,Недоліки: Нет,

0,А видеокарта ATX,

5,Всем советую ставить Windows 10. Тогда все драйвера сразу встанут. Даже диски не понадобятся!,Переваги: Топ,Недоліки: Нет,

5,Всем советую!!! Купил ПК недавно пока успел скачать только Watch Dogs 2 поставил все на максимум(ультра) где супер точное количество fps незнаю т.к. незнаю как его смотреть:\ Но по ощущениям fps так 60.,Переваги: Все,Недоліки: Видюха попалась dual, а не strix но тоже все тянет на ультро,

0,Какое точное название этой версии видеокарты 1060,Переваги: -,Недоліки: -,

5,Думаю в ближайшее время приобрести ПК и хотел бы более точно узнать о комплектующих (видел что как правило ставите все Asus), но модели ОЗУ, БП, какие именно накопители стоят, вентиляторы на корпусе (есть ли реобас например) и интересует поставка ПК вместе с упаковками от комплектующих?,Переваги: i7, gtx 10-й серии при приемлемой цене,Недоліки: Не попробуешь - не узнаешь,

5,Комп - супер, тихий и никаких ни с чем проблем (купил недавно). Только кабель питания немного расстроил (см. фото), я не рискнул его использовать и купил новый.,Переваги: топ,Недоліки: нету,

0,Рад покупке. Пока что работает как надо!,Переваги: Довольно таки тихий,красивая подсветка,дизайн,Недоліки: Пока что не заметил,

0,Подскажите, тянет ли современные игры в ультра (максимальном) качестве на 4K разрешении? С видеокартой всё ясно, она должна, но не уверен насчёт процессора: 6700 достаточен для этого или стоит обратить внимание на 7700? Заранее спасибо если будут ответы.,

0,Підскажіть яка материнська плата туть стоїть ?,

0,Підскажіть якій корпус в цій зборкі ?,

0,Какая видеокарта стоит?? по подробней пожалуйста. Собираюсь брать,хотел бы знать,

0,Смогу ли подключить два монитора?,

0,Здраствуйте Artline а в комп'ютере когда я его заберу уже будет система охлаждения или надо докупать,

0,Вопрос к представителю, если я закажу у вас этот комп можно чтобы мне пришли коробки от видяхи от мамы,от процессора, я просто коллекционер,

5,Ребят,гта ведьмак,радуга,и другие новинки на 60-80фпс держит, и еще вопрос видео карта с 3-мя винтелято рами,и какой фирмы видюха,Переваги: Все,Недоліки: Нету,

0,Вопрос представителю компании. Какой фирмы тут видеокарта?,

5,Крутой комп пришёл товар не шумит тихо работает, советую такой комп,Переваги: Крутой,Недоліки: Пока не нашёл,

0,в характеристиках описано что есть wifi модуль, откуда данный модуль если отсутствует в материнской плате а PCI слоты заняты только видеокартой?,

0,ОЗУ добавить возможно?,

