5,Ark survival evolvd будет тянуть?,

0,На нього тільки Віндовс встановити треба і все чи ще треба щось?,

0,Сколько ядер????,

0,А на скоко потянет gta 5 на high?,

0,Здравствуйте. Euro Truck Simulator 2 и Microsoft Flight Simulator X на каких настройках пойдут?,

4,А на цьому комп'ютері віндовс є?,

0,А есть шансы что после покупки сис. хар-ки будут отличаться с указаными на сайте?И еще кто играл в гта онлайн сколько фпс и идет ли на ультра?,

5,Сколь Фпс и на какой графе можна норм играть вот?,

0,Вопрос к компании Artline. Я купил пк включаю его и мне выдайот ошыбку. Подскажите пожалуйста что делать?,

0,Вопрос к производителю,какой DDR у видеокарты на данном ПК?,

5,Ark survival evolvd будет тянуть?,

0,На нього тільки Віндовс встановити треба і все чи ще треба щось?,

0,Сколько ядер????,

0,А на скоко потянет gta 5 на high?,

0,Здравствуйте. Euro Truck Simulator 2 и Microsoft Flight Simulator X на каких настройках пойдут?,

4,А на цьому комп'ютері віндовс є?,

0,А есть шансы что после покупки сис. хар-ки будут отличаться с указаными на сайте?И еще кто играл в гта онлайн сколько фпс и идет ли на ультра?,

5,Сколь Фпс и на какой графе можна норм играть вот?,

0,Вопрос к компании Artline. Я купил пк включаю его и мне выдайот ошыбку. Подскажите пожалуйста что делать?,

0,Вопрос к производителю,какой DDR у видеокарты на данном ПК?,

0,А какие совеременные игры этот комп может потянуть на максималках-средних ?,

0,Вопрос к Artline . Можете сказать пожалуйста . как и куда можно будет оплачивать кредит ?,

5,ПК отличный CSGO на ультрах GTA V не проверял,Переваги: За такие деньги такой мощный ПК,Недоліки: Шумит,

0,аион идёт на средних 70 до 50 фпс на замесах падает до 20 и ниже!!!!,Недоліки: видяха помоемому минус,

5,Скажите пожалуйста, какие новые игры он может потянуть, какие настройки, и сколько ФПС. Заранее спасибо.,

