5,Здраствуйте!Такой вопрос:сколько фпс будет , на низких настройках , кс го?Заранее спасибо!,
5,Такие вопросы 1 придосмотрен ли вход для вай фай модуля 2 какой виндовс здесь предпочтительный а какой наоборот 3 в комплекте с пк идёт диск с драйверами 4что за клавиатура и мышь ? 5 оплата товара при получении? 6 я заметил что при пробе купить товар нигде не нужно указывать личные данные ,как таким образом получить пк на почте ?,Переваги: Уйма,Недоліки: Нет,

0,Привет,решил купить этот пк ,по комментариям понял что мощный ,есть такие вопросы ,есть ли возможность самостоятельно установить вай фай модуль,какой виндовс здесь предпочтительней ,а какой категорически не подойдёт,причиается ли с пк диск с драйверами,что-за мишь и клавиатура в подарке ?,

0,г т а 5 потянет на максималке,

0,Ведьмак 3 пойдёт на каких настройках? Укажите фпс, если не трудно. Сопоставима ли графика на пк и на пс4? Если нет, то где лучше. Спасибо,

5,А гта 5 потянет ?,

0,Подскажите,какие игры не потянет?,

0,Пойдут ли современіе игры : ГТА 5, Ведьмак 3?,

4,Можно будет поменять видеокарту?,

0,А який подарок? де можна глянути на клаву і мишку?,

0,Вопрос к производителю! Сломалось гнездо для наушников на лицевой панели.Где можно в Харькове починить его,если компьютер на гарантии.,

0,Здравствуйте.Я бы хотел купить этот компьютер,чтоб снимать на нем разные игры...Подскажите,а в 60 фпс с шейдерами потянет?))Или В GTA-V?MortalCombat X?,

5,очень довольны,Переваги: отличный игровой компьютер на свою цену,Недоліки: нет,

0,а если я отдельно куплю виндоус 7 , и заплачу за установку виндоус,мне установят?Или можно только виндоус 10?,

0,Подскажите пожалуйста, как производиться установка системы на данном ПК?,

5,Можно ли будет установить данную материнскую плату fx6350,Переваги: Хороший пк по цене и комплектации,

0,Потянет ли Dota 2 на макс. настройках ?!,

0,Вопрос к тем кто купил какой fps в CS:GO на максималках?,Переваги: собираюсь покупать,Недоліки: -,

0,а какая операционная система стоит?,

0,Какой fps будет на ультрах в Wotld of Tanka?,

5,Обращение к представителю компании . От какого производителя стоит в етой зборке видеокарта,

5,Какой минимальный FPS в CS:GO?,

0,Так может или потянет ?,

0,Спустя 2 недели после покупки компа, и установки windows 7 выдало "СИНИЙ ЭКРАН" с кучей текста. Я не специалист по ПК, поэтому выключил кнопкой,затем вновь включил, пропал интернет, помогла повторная перезагрузка. До этого трижды зависал намертво при игре GTA 5 (лиц.), лечил выключением с кнопки т.к. никакие ctrl+alt+delete не помогали. Вопрос к производителю: это гарантийный случай?,Переваги: -,Недоліки: В GTA 5 (лиц.) несколько раз зависал. Сегодня 22.02.16 в этой-же игре, находясь на паузе выскочил "Blue Screen",

0,Потянет ли цей комп gta 5 на високих настройках . И стоит ли иво вопще покупать,

0,Неплохой комп., соответствует заявленным хар-м. Корпус такой, как на фото. При установке windows 7 привод не смог прочитать драйвера с диска, идущего в комплекте. При установке GTA 5 (лицензия) около 10 раз выскакивала ошибка "несоответствие суммы".,Переваги: Нормальный комп.,Недоліки: Проблемный dvd привод. Неё все диски читает.,

0,Потянет-ли Gta 5, на каких настройках и сколько FPS?,

5,С каким ФПС идут fifa 16,call of dytu,cs go. Смотрел требования вроде должни ити. Интересно мнение людей,зарание спасибо.,Переваги: Хороший проц.,

0,А можно на этот компьютер поставить две видеокарты или одну только мощнеё,

5,тянет все игры которые старый комп не тянул,Переваги: все отлично,Недоліки: нет,

0,Скажите на каких настройках графики он потянет Farcry4,Payday2,Gta5,Cs go,Dota2,Star wars battlefront,Battlefield hard line,mad max,Call of duty новые части,Fallout4,Mortal Kombat 10,Wolfenstein P.S заранее спасибо,

5,Какя фирма видеокарты?Asus,MSI.Идёт ли Battlefield 4 на максимальых?,

0,А этот ПК будет тянуть PAYDAY 2 Cs Go,

0,А слот для ssd диска?,

0,DayZ потянет?,

0,Можно замінити блок живлення на 1000ват при покупці,

5,Классный аппарат, сегодня ребенку купил (получил) поставил систему, сын запустил игры которые на предыдущем компе не шли!!!,Переваги: Неплохое железо, с поставленными задачами справляется!,Недоліки: нет,

0,Скільки на цьому пк дисків памяті.,

0,какой лучше этот или этот?http://hard.rozetka.com.ua/artline_gaming_x46_v03/p4740036/,

5,Полет нормальный, комп супер, поставил вин 10, никаких нареканий нет,Переваги: все класс,Недоліки: пока нет,

0,Очень харошая сборка, идут очень много современных игр. GTA 5, Dying light, Fallout 4 работают без каких либо нареканий. Это только те которые успел скачать и поробовать. Стоит ОС Win 10 x64, однозначно стоит своих денег.,

0,сколько кулеров на видеокарте?,

5,компютер полностю оправдал мои ожидания и требования WOT летает на максималках блек десерт на средних немного раздражает шум кулеров за такие деньги думаю он лутший в своей ценовой категории,Переваги: комп хорош,Недоліки: шумный,

0,А возможно ли поставить 2 видеокарты?,

0,А те кто купил данный ПК потянет такие игровые новинки как Gta5,Fallout4,Wolfenstein the old blood и the new order,Call of duty все части,Mad Max,Battlefield hard line,Star wars battlefront,Mortal Kombat 10,Dead Pool,CS GO,потянут хотя бы на минималках или ультра 60fps 4k P.S заранее спасибо,

0,подскажыте пожалуста wot -танки идут в HD ?,

0,Если я не ошибаюсь тут стоит Asus PCI-Ex Radeon R7 360 2GB GDDR5 ( если да,то я его куплю ),

5,Хочу купить этот пк. Подскажите как звук у него,кризис 3 потянет,

0,У меня вопросы к производителю: 1. Можно ли доукомплектовать эту модель при покупке двумя кулерами на вдув и выдув, 2. Модель материнки, есть ли возможность в перспективе установить на неё i5 или i7. 3. Видеокарта тут должно быть с активным охлаждением?,

4,Купив собі 2 дні тому це чудо. Є декілька моментів. Скажу відразу що гарантія в мене накрилась мідним тазом ще в перший день. Ситуація така, встановив віндовс з флешки (власний диск накрився залишився лише образ) все було нормально десь 30 секунд, а потім ПК розпочав процес відключення, після цього вже не увімнкнувся, висить заставка виробника материнської плати. Перші думки невтішні, або згорів вінчестер або завис біос. Для вирішення даної проблеми довелось відкривати кришку системного блока для того щоб відключити вінчестер і зайти в біос. В біосі зробив відкат до заводських налаштувань і все вуаля ПК працює як годинник. Тому для майбутніх покупців порада відразу після вмикання ПК зайдіть в біос і зробіть відкат. Для шанувальників танків, WOT на максимальних налаштуваннях видає 55-65 фпс це без розгону процесора. Хороший ПК, підключав через HDIM телевізор, все працює ідеально. Дякую Розетці за швидку доставку.,Переваги: Хороший ПК. Тихо працює.,Недоліки: Проблеми з біосом.,

0,Какой лутше этот , или http://hard.rozetka.com.ua/artline_gaming_x46_v02/p4739966/,

0,Питання до офіційного представника компанії, яка відеокарта тут стоїть? R7 260 чи R7 360 між ними велика різниця. Дайте відповідь будь-ласка.,

0,А на материнской плате есть PCI или PCI express x1,

0,Так AMD Radeon R7 360 или AMD Radeon R7 260Х все таки?,

0,Вот на видео по ссылке я GTAV на этом компе запускал,монитора с fullhd разрешением у меня нет, играл на телеке через HDMI. Могу сказать что почти все игры в hd разрешении 1366х768 идут на ультрах. А такие игры как MGS V, Mad Max, Mortal Kombat X на максимальных настройках графики в hd разрешении выдают стабильно 60 фпс, GTAV 40 фпс https://www.youtube.com/watch?v=88pwsn3IaxI,

