5,Здраствуйте!Такой вопрос:сколько фпс будет , на низких настройках , кс го?Заранее спасибо!,

0,сколько фпс будет в ворлд оф танкс на середних и в гта 5 на минималках с манитором с VGA？и да подойдет для него монитор acer v193w с VGA?,

0,Подскажите какой бюджетный монитор к блоку лучше всего подойдёт,

5,Как он себя покажет в танках???,

5,Скажите, пожалуйста. Сколькь будет ФПС в GTA 5 на средних?,

0,Пойдет ли Dishonoured 2 на Средних, мне хотя бы 30FPS, так эта игра слишком требовательна очень важно мнение Если буду использовать HD или Full HD монитор,,

0,Можно поставить сюда 1050 ti,

5,Simcity5 на ультра настройках сколько фпс будет??,

4,Сколько будет фпс в GTA V,

0,Ведьмак 3 на средних пойдет?,

5,Здраствуйте!Такой вопрос:сколько фпс будет , на низких настройках , кс го?Заранее спасибо!,

0,сколько фпс будет в ворлд оф танкс на середних и в гта 5 на минималках с манитором с VGA？и да подойдет для него монитор acer v193w с VGA?,

0,Подскажите какой бюджетный монитор к блоку лучше всего подойдёт,

5,Как он себя покажет в танках???,

5,Скажите, пожалуйста. Сколькь будет ФПС в GTA 5 на средних?,

0,Пойдет ли Dishonoured 2 на Средних, мне хотя бы 30FPS, так эта игра слишком требовательна очень важно мнение Если буду использовать HD или Full HD монитор,,

0,Можно поставить сюда 1050 ti,

5,Simcity5 на ультра настройках сколько фпс будет??,

4,Сколько будет фпс в GTA V,

0,Ведьмак 3 на средних пойдет?,

0,У кого какой монитор ? Не могу выбрать,

0,Собираюсь купить этот пк для звукозаписи и иногда игр,например ГТА или TheLongDark,ну или что то подобно,что касается игры как ведёт себя,шумит ли , и на сколько нагревается?Была мысль купить другой корпус с более мощным охлаждением или этого будет достаточно?,Переваги: +,Недоліки: +,

0,ДУМ 4 и кс го на минималкас с почти макс разрешениям екрана тянет в 40 фпс ????,Переваги: &,Недоліки: *,

0,Сколько фпс будет у Simcity(2013) на ультра с дополнениями,и Cities Skyilines на средних с дополнениями,ответьте пожалуйста?????,Переваги: не купил,Недоліки: не купил,

0,К продавцу! Здраствуйте!! Подойдёт этот компьютер для Steem игры Red Orchestra 2 ? -скажите пожалуйста.,

5,Как здесь з вай фай , в описании написано чтовайфай не предустановлено ?,Переваги: О,Недоліки: -,

0,Здравствуйте. Можна задать несколько вопросов? Потянет ли игры такие как GTA V, ARK Survival evolved, Far Cry Primal, Battlefield 1 и DOOM 4 и на каких настройках... Надеюсь хотя-бы на средние. Заранее спасибо.,Переваги: Еще не купил,Недоліки: Еще не купил,

0,Скажите пожалуйста а Скока будет фпс в Unturned на максималках?,

0,Подойдет ли для работы в фотошопе и Sketchbook pro? Не будет ли видно лесенок в градиенте при хорошем ips экране?,

5,Можно ли подключить 2 компьютера к одному Wifi ролтеру ?!,

5,КС го, потянет,

5,Чи піде 10 віндуза?,

5,Доброго дня! Є одне питання? Дота піде на цьому компі?,Недоліки: -,

5,ПК хороший за свою цену. За месяц использования начал перегреваться процессор. Что мне нужно сделать что бы он не перегревался?,Переваги: технические характеристики,Недоліки: Нет,

5,Доброго времени суток ! Раст потянет на средних?,Недоліки: -,

5,Для майнінга підійде?,

0,Охлаждение справляется с треб. Играми?,

0,Фифу 17 вытянет?,

0,Сколько весит пк?,

0,А можно что бы было без мышки и клавы в подарок? они как бы есть :),

0,Сколько фпс в Unity?,

0,Скажіть, будь ласка, чи витягне даний системник 3 монітори?,

5,Какие игры потянет fps так 40,

5,Подскажите пожалуйста, пойдет ли на данном ПК Playerunknown's battlegrounds? Если пойдет, в сколько fps? Заранее спасибо.,Переваги: Еще не купил,Недоліки: Еще не купил,

0,Подойдет этот монитор? Dell S2216H,

0,Что такое модуль вай фай и как его установить? (до этого ноутбук был),

0,А вы можете на нем установить Виндоус7? Чтобы самому не мучаться, а сразу подключить и играть??,

0,Оптимальный ли этот пенек для стрима? Стоит ли на него рассчитывать как на игровой пк для ГТА, Лара крофт 2016, ведьмак?,

0,А можно его без дисковода купить?,

5,Может кто нибудь видео с тестами скинуть? Очень прошу, думаю брать или нет,Переваги: -,Недоліки: -,

5,Сколько на максималке в доте кадров?,

5,Хочу купить этот комп подскажите пожалуйста какой из мониторов к нему подойдёт : LG 23MP57HQ-P(код 2000567) или Philips 243V5QHABA/01(код 11436268) и можно ли заказать с установленной Виндоус( если да то на сколько дороже),Переваги: Не купил пока,Недоліки: Не купил пока,

0,нужно делать предоплату?,или допустим я через новую почту буду брать и платить после того как увижу товар?,

5,Купил этот агрегат, вместе с ним заказал еще одну планку Kingston DDR3-1600 8192MB PC3-12800 (KVR16N11/8_KVR16N11H/8) (стояла CRUCIAL 8gb 1600) После установки планки биос просто не увидел новую планку. После установки Win8.1 все 16 гб определились нормально. Теперь производительность: ГТА5 на ультрах (при выключенном размытии, не люблю его) - 75-90 фпс в самых динамичных сценах. Правда, это при 16гб памяти. Fallout 4 - на ультрах - 55-60фпс И в ГТА и в Fallout температура GPU не поднималась выше 70 градусов (программа Speccy). рендер Vray3 в Sketchup с включенным GPU работает шутсро. Показатели фпс написал реальные при этой конфигурации + 8гб рам 1600. Выводы делайте сами. Я очень доволен.,Переваги: Тихий, мощный проц, дизайн вполне приличный, отличная цена,Недоліки: Всего 2 слота DIMM (для оперативки),

4,Можно ли стримить КС ГО на средних настройках ?!:),

4,У меня есть несколько вопросов. 1.Windows (7/10) будет сразу стоять, или надо самому установить? 2.Он будет уже собран, или надо будет самому сабирать? 3.Какой луче монитор к этому ПК? 4.Охлаждения-кулер? 5.Кто пользуеца долго, заметил какие-то проблеми? Спасибо за то-што ответили, за рание.,Переваги: Ну хорошая производительность, за давально низкую цену,Недоліки: Ищо не купил, рано судить.,

4,Вопрос к представителю компании, как чистить и менять термопасту не нарушая гарантии (не вскрывая)?,Переваги: Быстрая доставка. Товаром доволен.,Недоліки: Кабель для монитора у меня старого образца (VGA), пришлось покупать переходник.,

0,А сколько FPS при записи майнкрафта будет?,

0,Собирался сам собирать, но посчитал..что с учетом доставки и т.д цена почти та же самая, решил не тратить время на сборку и купил сразу собранный. На нём можно поиграть в гта 5, если кому интересно. Средние вытянет. Доволен системником.,

0,Розетка, подскажите, пожалуйста. У меня есть своя видеокарта Radeon R7 210 1gb 128 bit. от старого компа. Имеет ли смысл ставить ее как вторую в этот системник? Будет ли прирост производительности? Не особо разбираюсь в подобных вещах. Спасибо,

5,А можно без мышки и клавиотуры,Переваги: Не знаю,Недоліки: Незн,

5,Вроде норм . Я его закажу и он придет в чем? Не испортиться ли при перевозе?,

0,Яка фірма клавіатури і мишки?,

5,Какая здесь стоит видео карта можете дать название !,

5,Какой монитор к ним у подходит ?,

0,Кто знает Dark Souls 3 на максималках сколько FPS подскажите пожалуйста ? Очень важно знать ? я,Переваги: Не покупал ещё,Недоліки: Не покупал ещё,

0,Важно знать,может кто то тестировал Dark Souls 3 на максимальных сколько FPS подскажите пожалуйста?,

0,overwatc потянет на средних?,

5,Отримали системний блок і клавіатуру і мишку в подарунок, встановили windows 7, була заминка з драйвером на мережеву карту, але розібрались і встановили ( кому потрібно ось така мережева карта встановлена на цьому ПК : "Realtek RTL8168/8111 PCI-E Gigabit Ethernet Adapter". Для монітору вам знадобиться перехідник з VGA на DVI. Системний блок влаштовує на всі 100%. Для любителів WOT, на максимальних параметра грати можна) Приємно працювати з rozetka.com.ua,Переваги: Швидкий, малошумний, потужний, подарунок клавіатура і мишка від компанії,Недоліки: не виявлено,

0,Ставлю Windows 7 , потом драйвера и сетевой не ставится. Какая в нем сетевая карта?,

5,А он привезеться с виндой ли і собраний ответь не пожалуста, і какой лучше монітор купить подешевле Спасиба за ответ,Переваги: Не знаю ішо не купил,Недоліки: Не знаю ішо не купил,

0,А овервотч потянет,

5,Добрий день через 11 днів 2017 рік умене день рождения пожалуста не полинуйтесть напиши те потянит ли тут ігра гта 5 лицензированая і ватч догм 2 і іщо фаллаут 4 і скоко фпс спасибо за ответ день народження 15,Переваги: Не знаю ішо не купил,Недоліки: Не знаю ішо не купил,

0,подскажите, танки на максималке потянет?,Переваги: не знаю,Недоліки: не знаю,

5,а игра watch dogs 2 пойдет на минималках или на максималках и сколько будет фпс,Переваги: крутой комп,Недоліки: нету,

0,ребзя, сколько фпс в кс го на средних ???,

0,Можно лише при покупки установить OC?,

0,Есть ли пломбы на корпусе? На случай если после доставки в нем окажется не все комплектующее. Чтобы не пришлось доказывать что я не вскрывал.,

0,А ARK: Survival Evolved потянет ? И если потянет сколько примерно фпс?,

5,А яка у нього вінда,Переваги: Незнаю ше не купив,Недоліки: Незнаю,

0,Ребята потянет GTA 5 на максималках???,

0,Потянет RUST на Средних?,

0,ребят Cs go , на Максималках пойдёт?,

0,а дисковод есть?,

0,А можно один вопрос ?.Какая мышка и клавиатыра идет в комплекте зарание спасибо!,

5,Народ скажите как он тянет сучасні ігри!,

0,скажіть а доту потягне,Переваги: не купил,Недоліки: не купил,

0,FIFA 17 и gta 5 будет лагать?,

0,Потянет Rust, CS:GO, DayZ, Arma3, The Forest, и еще пару игр на максимальных/средних настройках?,

5,Ребят помогите. Какой компьютер лучше? ARTLINE Gaming X44 v03 или ARTLINE Gaming X46 v02 .,Переваги: Сравниваю!!!!,Недоліки: Не купил.,

5,Потяне gta5 на максимальних настройках,

0,Watch Dogs будет лагать или нет?,

0,А Overwach хоть на минимальном графоне потянет?,Переваги: Незнаю,Недоліки: Не купил,

4,Пойдет ли Dayz на каких настройках и какой фпс будет ???,Переваги: Нет,Недоліки: Нет,

0,Ведьмак 3 и Фолач 4 , скок фпс будет ?,

5,Подскажите пожалуйста сюда подойдет Видеокарта Asus PCI-Ex GeForce GTX 950 Strix 2048MB GDDR5 (128bit) (1140/6610) (2 x DVI, HDMI, DisplayPort) (STRIX-GTX950-DC2OC-2GD5-GAMING)!?,Переваги: Не купил,Недоліки: Не купил,

5,А на счет GTA 5, на максималка летает, или немного подлагивает? И как GTA 5 пойдёт на ультра настройках?,Переваги: Цена,Недоліки: Нету,

0,Будет ли тянуть КС ГО на средних настройках?,

0,При подключении к монитору по vga порту компютер посл включения пискнул и загудел, а монитор пожаловался на отсутствие сигнала и перешёл в режим ожидания. Никаких последующих действий со стороны техники не последовало.,Переваги: Красиво гудит,Недоліки: Не запускает bios,

0,Представители Artline можно поменять на видео карту Nvidia GeForce GTX 950, при покупке.,

0,А можно поменять видеокарту тут? скажите.Заранее спасибо!,Переваги: Не купил,Недоліки: Не купил,

0,Пойдёт кс го?,

0,вопрос к спецам-возможна ли установка HDMI разъема на данном аппарате?,

0,А если есть Wi-fi на мониторе а на блоке нет тогда если подключить их вместе то вай фай на компе будет???,

0,Еще не купил.Какая здесь модель материнской плата?,

3,Сколько будет фпс в gta 5 на средних? на Сталкере: Зов Припяти на Максималках и.. потянет ли Overwatch на средних и с каким фпс?,Переваги: Не знаю,Недоліки: Еще не приобрел,

0,Будет ли возможность стримить игры на подобие доты,кс го на этом пк?,

0,У мене питання тут одразу встановлений Windows якщо так то який?,

0,Сколько слотов для оперативной памяти и сколько планок установлено изначально? Какой предел оперативной памяти? Есть ли возможность установки 2-й видеокарты и установки нескольких мониторов?,

0,Потянет фифу 17??,

5,Сравнивать в принципе не с чем, предыдущий ПК был допотопным. Но, винда 10 стала сразу, работает как ракета, не шумный, комплектующие соответствуют описанию. Покупкой абсолютно точно доволен. Единственный минус-это было ожидание ПК)) (Успел выхватить эту махину по аукционной цене, это ),Переваги: Относительно не дорогая цена, по отнощению к конкурентам, клевый дизайн.,Недоліки: Во время пользования, аж 1 день, не обнаружено))),

0,Какая мышка и клавиатура идут в подарок?,

0,Какой фирмы установлен блок питания на данной модели?,

0,Crysis 3. watching dogs . Assassin's Creed Syndicate. Fallout 4. Far Cry 4 пойдет?,

5,просто ракета за такие деньги. на данный момент пользуюсь около 7 дней,и пока нет такой игрухи или задачи с которой он не справился.,Переваги: МОРЕ,Недоліки: -,

0,fifa 17 потянет?,

0,А можно проц поменять на fx-4300?,Переваги: Нет переплаты,Недоліки: Процессор чуток слабоват, хоть и вытягивает видяху на полностю, в играх, зависимых от процессора, не самый лучший фреймрейт будет!,

0,а гта 5 на мексимум потянет,

0,А гарантия на весь пк, или на комплектующие ?,

0,Ищу ПК для GTA 5,потянет?,

5,Скажите пожалуйста, какая мышка и клавиатура в подарок? Без проводная?,

5,А можна поставити свій жорсткий дис?або щоб було їх два,свій і що у цьому комп'ютері?,

0,ГТА 5 на минималках потянет ? Заранее спасибо,

0,Подскажите пожалуйста Можна ли нормально снимать видео на ютуб по CS:GO или Dota2 на этом пк!,

0,Сколько будет fps в кс го на ультрах?,

5,Все, вибачте, довго чекав на нього, тому злий був, вже сам у всьому роздуплився, зараз налаштовую, все чотко, от тільки гудить падло...не дуже він тихий,Переваги: все чотко,Недоліки: гудить,

2,питання до Artline представників, я сьогодні отримав це "чудо", ледве монітор підключив, але то таке, скажіть мені будь ласка, що з віндою? Я ставлю свою вінду, обираю х64, далі перевірка файлів, доходить до вибору мови, і все, тухне клава і мишка, і нічого не можу зробити далі, як це називається?!,

4,а с ним стрим можна руба ти чи видео снимати,

5,А виндоус который покупается в комплекте идет сразу предустановленной на пк? Или просто диск??,

5,А як получити клавіатуру і мишку в подарок? І яка модель мишки і клавіатури ?,

4,Подскажите пожалуйста, как он себя покажет в мультимедийных задачах, таких как монтаж, рендеринг? Можно ли ожидать хорошей производительности, или он все же расположен к играм в основном?,

0,У меня вопрос. Потянет ли Mirrors ege 2 на ультра настройках. заранее спасибо.,

0,Какие и сколько охлождающих систем имеет этот ПК ?,

0,У мене питаня чи можна підєднати цей системний блок до ноутбука?,Переваги: Хороший,Недоліки: Як для мене немає,

0,Представители Artline можно поменять на видео карту Ge force Gtx 960,

0,Подскажите пожалуйста - потянит ли этот пк 4К или только fullhd?,

0,Не буду описывать., напишу только коротко о хорошем\плохом. Смотрите достоинства и недостатки. Разве что скажу что для такой цены этот системник довольно шустрый.,Переваги: Тихий, шустрый и без проблемный.,Недоліки: Пломбы. Пришлось оборвать когда полез чистить.,

0,Опрос к фирме! Или к пользователям! А Cs:Go на максимальных настройках потянет? Если да, то лагать не будет?,

5,Потянет Дота на Ультра настройках (с сглажеванием)?,

5,Какая мышь идет в подарок?,

0,Есть ли тут разьем PCI для установки вай-фай модуля?,

0,Вопрос к компании: какой (если можно конкретный), как, и куда устанавливать модуль?,

0,Тут есть блок питания пк собран всеь?,

0,Клавиатура которая идет в подарок механическая или мембранная?,

0,На каких настройках потянет GTA 5,CS:GO,Far Cry 4,Dying Light и какой фпс будет ?,

0,Любитель World of Tanks. На каких настройках в HD пакете пойдёт игра на этом компе и с каким ФПС ?,

0,потянет ли overwatch? и на каких настройках?,

0,Какой лучше для игр этот или этот http://m.rozetka.com.ua/offer/4739966/,

